{
  "session_id": "live_20260402_132135_CAPTURE_continuous_trial01",
  "timestamp": "2026-04-02T05:21:36Z",
  "event_type": "no_change",
  "roi_id": "main_compartment_live",
  "confidence": 0.608,
  "before_frame": "/home/dk/桌面/smartHome/code_1/data/test_sessions/module12_realtime_live/live_20260402_132135_CAPTURE_continuous_trial01/stage1/before.jpg",
  "after_frame": "/home/dk/桌面/smartHome/code_1/data/test_sessions/module12_realtime_live/live_20260402_132135_CAPTURE_continuous_trial01/stage1/after.jpg",
  "change_regions": [
    {
      "x": 508,
      "y": 272,
      "width": 132,
      "height": 108,
      "score": 0.055
    },
    {
      "x": 593,
      "y": 185,
      "width": 47,
      "height": 78,
      "score": 0.010
    },
    {
      "x": 519,
      "y": 236,
      "width": 39,
      "height": 80,
      "score": 0.006
    },
    {
      "x": 607,
      "y": 263,
      "width": 33,
      "height": 24,
      "score": 0.002
    },
    {
      "x": 612,
      "y": 365,
      "width": 28,
      "height": 15,
      "score": 0.001
    },
    {
      "x": 589,
      "y": 249,
      "width": 12,
      "height": 24,
      "score": 0.001
    },
    {
      "x": 542,
      "y": 297,
      "width": 21,
      "height": 19,
      "score": 0.001
    },
    {
      "x": 579,
      "y": 258,
      "width": 6,
      "height": 10,
      "score": 0.000
    },
    {
      "x": 547,
      "y": 317,
      "width": 5,
      "height": 7,
      "score": 0.000
    },
    {
      "x": 543,
      "y": 305,
      "width": 6,
      "height": 7,
      "score": 0.000
    },
    {
      "x": 524,
      "y": 287,
      "width": 5,
      "height": 8,
      "score": 0.000
    },
    {
      "x": 605,
      "y": 361,
      "width": 6,
      "height": 5,
      "score": 0.000
    },
    {
      "x": 591,
      "y": 244,
      "width": 10,
      "height": 5,
      "score": 0.000
    },
    {
      "x": 576,
      "y": 236,
      "width": 9,
      "height": 4,
      "score": 0.000
    },
    {
      "x": 565,
      "y": 299,
      "width": 5,
      "height": 4,
      "score": 0.000
    }
  ],
  "objects": [
    {
      "category": "unknown",
      "name": "unknown",
      "count_delta": 0,
      "remain_level": 0.000
    }
  ],
  "need_user_confirm": false
}
