{
  "session_id": "live_20260402_160423_CAPTURE_fullview_30fps_trial01",
  "timestamp": "2026-04-02T08:04:23Z",
  "event_type": "put_in",
  "roi_id": "main_compartment_live",
  "confidence": 0.980,
  "before_frame": "/home/dk/桌面/smartHome/code_1/data/test_sessions/module12_realtime_live/live_20260402_160423_CAPTURE_fullview_30fps_trial01/stage1/before.jpg",
  "after_frame": "/home/dk/桌面/smartHome/code_1/data/test_sessions/module12_realtime_live/live_20260402_160423_CAPTURE_fullview_30fps_trial01/stage1/after.jpg",
  "change_regions": [
    {
      "x": 379,
      "y": 171,
      "width": 153,
      "height": 227,
      "score": 0.064
    },
    {
      "x": 446,
      "y": 410,
      "width": 35,
      "height": 38,
      "score": 0.001
    },
    {
      "x": 632,
      "y": 16,
      "width": 8,
      "height": 40,
      "score": 0.001
    },
    {
      "x": 454,
      "y": 456,
      "width": 27,
      "height": 13,
      "score": 0.000
    },
    {
      "x": 504,
      "y": 215,
      "width": 7,
      "height": 14,
      "score": 0.000
    },
    {
      "x": 445,
      "y": 428,
      "width": 14,
      "height": 12,
      "score": 0.000
    },
    {
      "x": 468,
      "y": 469,
      "width": 10,
      "height": 6,
      "score": 0.000
    }
  ],
  "objects": [
    {
      "category": "unknown",
      "name": "unknown",
      "count_delta": 1,
      "remain_level": 1.000
    }
  ],
  "need_user_confirm": false
}
