{
  "session_id": "fangru_20260322_205710",
  "timestamp": "2026-03-22T12:57:18Z",
  "event_type": "put_in",
  "roi_id": "main_compartment",
  "confidence": 0.980,
  "before_frame": "D:/AAA研电赛/code_0/data/sessions/fangru_20260322_205710/before.jpg",
  "after_frame": "D:/AAA研电赛/code_0/data/sessions/fangru_20260322_205710/after.jpg",
  "change_regions": [
    {
      "x": 0,
      "y": 0,
      "width": 720,
      "height": 1280,
      "score": 0.954
    },
    {
      "x": 394,
      "y": 334,
      "width": 21,
      "height": 22,
      "score": 0.000
    },
    {
      "x": 370,
      "y": 337,
      "width": 17,
      "height": 17,
      "score": 0.000
    },
    {
      "x": 344,
      "y": 425,
      "width": 7,
      "height": 8,
      "score": 0.000
    },
    {
      "x": 412,
      "y": 340,
      "width": 7,
      "height": 6,
      "score": 0.000
    },
    {
      "x": 348,
      "y": 408,
      "width": 8,
      "height": 4,
      "score": 0.000
    },
    {
      "x": 0,
      "y": 1,
      "width": 5,
      "height": 7,
      "score": 0.000
    },
    {
      "x": 351,
      "y": 423,
      "width": 7,
      "height": 3,
      "score": 0.000
    },
    {
      "x": 371,
      "y": 372,
      "width": 5,
      "height": 6,
      "score": 0.000
    },
    {
      "x": 2,
      "y": 0,
      "width": 7,
      "height": 3,
      "score": 0.000
    },
    {
      "x": 398,
      "y": 345,
      "width": 5,
      "height": 6,
      "score": 0.000
    },
    {
      "x": 393,
      "y": 355,
      "width": 7,
      "height": 2,
      "score": 0.000
    },
    {
      "x": 401,
      "y": 382,
      "width": 3,
      "height": 4,
      "score": 0.000
    },
    {
      "x": 402,
      "y": 351,
      "width": 5,
      "height": 2,
      "score": 0.000
    },
    {
      "x": 349,
      "y": 424,
      "width": 3,
      "height": 4,
      "score": 0.000
    },
    {
      "x": 398,
      "y": 379,
      "width": 4,
      "height": 4,
      "score": 0.000
    },
    {
      "x": 409,
      "y": 337,
      "width": 3,
      "height": 3,
      "score": 0.000
    },
    {
      "x": 373,
      "y": 346,
      "width": 3,
      "height": 4,
      "score": 0.000
    },
    {
      "x": 409,
      "y": 348,
      "width": 4,
      "height": 2,
      "score": 0.000
    },
    {
      "x": 415,
      "y": 337,
      "width": 2,
      "height": 4,
      "score": 0.000
    },
    {
      "x": 312,
      "y": 418,
      "width": 4,
      "height": 2,
      "score": 0.000
    },
    {
      "x": 389,
      "y": 352,
      "width": 3,
      "height": 3,
      "score": 0.000
    },
    {
      "x": 346,
      "y": 423,
      "width": 3,
      "height": 2,
      "score": 0.000
    },
    {
      "x": 413,
      "y": 353,
      "width": 2,
      "height": 2,
      "score": 0.000
    },
    {
      "x": 382,
      "y": 394,
      "width": 3,
      "height": 2,
      "score": 0.000
    },
    {
      "x": 8,
      "y": 5,
      "width": 2,
      "height": 3,
      "score": 0.000
    }
  ],
  "objects": [
    {
      "category": "unknown",
      "name": "unknown",
      "count_delta": 1,
      "remain_level": 1.000
    }
  ],
  "need_user_confirm": false
}
